{
  "package_id": "PKG-CIV-001",
  "title": "Ares Alpha Research Package",
  "question_ids": ["Q-024"],
  "preregistration_ids": ["PRE-EXP-CIV-001-001"],
  "experiment_ids": ["EXP-CIV-001"],
  "result_paths": [
    "results/exp-civ-001/baseline-001.json",
    "results/exp-civ-001/comparative-001/baseline.json",
    "results/exp-civ-001/comparative-001/comparison.json"
  ],
  "report_paths": [],
  "insight_ids": ["INS-001"],
  "evidence_item_ids": [],
  "runtime": "CivilOS",
  "code_version": "b42f3f42760cbf39a128acc6fa6ac562ae0c37aa",
  "reproducibility_status": "reproducible",
  "experiment_quality_score": null,
  "evidence_level": "E2",
  "limitations": [
    "The current package is based on one model implementation and has no independent external replication.",
    "The failure-boundary suite is preregistered but not yet completed.",
    "External empirical evidence has not yet been linked to INS-001."
  ],
  "publication_status": "draft",
  "created_at": "2026-09-09T19:15:00Z",
  "updated_at": "2026-09-09T19:15:00Z"
}
